GEO_ID,GEO_ID_2,MSA_NAME,POPGROUP.id,POPGROUP.display-label,TOT_POP
310M200US44940,44940,Sumter SC Metro Area,1,Total population,107777
310M200US45060,45060,Syracuse NY Metro Area,1,Total population,661914
310M200US45220,45220,Tallahassee FL Metro Area,1,Total population,374690
310M200US45300,45300,Tampa-St. Petersburg-Clearwater FL Metro Area,1,Total population,2888458
310M200US45460,45460,Terre Haute IN Metro Area,1,Total population,171925
310M200US45500,45500,Texarkana TX-AR Metro Area,1,Total population,149527
310M200US45540,45540,The Villages FL Metro Area,1,Total population,108501
310M200US45780,45780,Toledo OH Metro Area,1,Total population,607631
310M200US45820,45820,Topeka KS Metro Area,1,Total population,234167
310M200US45940,45940,Trenton NJ Metro Area,1,Total population,370212
310M200US46060,46060,Tucson AZ Metro Area,1,Total population,998537
310M200US46140,46140,Tulsa OK Metro Area,1,Total population,962676
310M200US46220,46220,Tuscaloosa AL Metro Area,1,Total population,235570
310M200US46340,46340,Tyler TX Metro Area,1,Total population,217552
310M200US46520,46520,Urban Honolulu HI Metro Area,1,Total population,984178
310M200US46540,46540,Utica-Rome NY Metro Area,1,Total population,297592
310M200US46660,46660,Valdosta GA Metro Area,1,Total population,143291
310M200US46700,46700,Vallejo-Fairfield CA Metro Area,1,Total population,425753
310M200US47020,47020,Victoria TX Metro Area,1,Total population,97509
310M200US47220,47220,Vineland-Bridgeton NJ Metro Area,1,Total population,157035
310M200US47260,47260,Virginia Beach-Norfolk-Newport News VA-NC Metro Area,1,Total population,1706878
310M200US47300,47300,Visalia-Porterville CA Metro Area,1,Total population,454033
310M200US47380,47380,Waco TX Metro Area,1,Total population,258915
310M200US47460,47460,Walla Walla WA Metro Area,1,Total population,63715
310M200US47580,47580,Warner Robins GA Metro Area,1,Total population,186246
310M200US47900,47900,Washington-Arlington-Alexandria DC-VA-MD-WV Metro Area,1,Total population,5949403
310M200US47940,47940,Waterloo-Cedar Falls IA Metro Area,1,Total population,169442
310M200US48060,48060,Watertown-Fort Drum NY Metro Area,1,Total population,118947
310M200US48140,48140,Wausau WI Metro Area,1,Total population,135177
310M200US48260,48260,Weirton-Steubenville WV-OH Metro Area,1,Total population,121919
310M200US48300,48300,Wenatchee WA Metro Area,1,Total population,113866
310M200US48540,48540,Wheeling WV-OH Metro Area,1,Total population,145677
310M200US48620,48620,Wichita KS Metro Area,1,Total population,638884
310M200US48660,48660,Wichita Falls TX Metro Area,1,Total population,151215
310M200US48700,48700,Williamsport PA Metro Area,1,Total population,116656
310M200US48900,48900,Wilmington NC Metro Area,1,Total population,268257
310M200US49020,49020,Winchester VA-WV Metro Area,1,Total population,132050
310M200US49180,49180,Winston-Salem NC Metro Area,1,Total population,651630
310M200US49340,49340,Worcester MA-CT Metro Area,1,Total population,928405
310M200US49420,49420,Yakima WA Metro Area,1,Total population,247408
310M200US49620,49620,York-Hanover PA Metro Area,1,Total population,439660
310M200US49660,49660,Youngstown-Warren-Boardman OH-PA Metro Area,1,Total population,556243
310M200US49700,49700,Yuba City CA Metro Area,1,Total population,168684
310M200US49740,49740,Yuma AZ Metro Area,1,Total population,202987
